commit	anchor_log_loss	anchor_brier	research_score	status	change_type	description
exp91-scorecard-pressurecal-v3	1.1252	0.6099	1.1006	kept	evaluation	Exp91+scorecard + R3 pressure-cal v3: extended choker to within3_count>=5 & win_rate=0 (catches Joel Dahmen, Max Greyserman); anchor=1.125 NEW BEST; R3=1.022
exp91-scorecard-pressurecal-v4	1.1062	0.5987	1.0887	kept	evaluation	Exp91+scorecard + R3 pressure-cal v4: name specific contenders in redistribution note (not generic "2nd/3rd"); anchor=1.106 NEW BEST! R3=0.963 BEST; research=1.089 NEW BEST!
exp91-scorecard-pressurecal-v5	1.0988	0.5956	1.0840	kept	evaluation	Exp91+scorecard + R2+R3 pressure-cal v5: added R2 leader pressure calibration (r2_leads and r2_within3); anchor=1.099 NEW BEST! R2=1.134 (from 1.148); research=1.084 NEW BEST!
