commit	accuracy	cadence	test_nll	training_records	status	description
591432f	0.7080	0:342,1:137,2:18,3:2,4:1	0.109	2301	keep	v3 baseline reasoning-in-tool-call, LR≈5e-4, lora_rank=32, 1 epoch
c7397e5	0.7080	0:377,1:98,2:21,3:4	0.107	2301	discard	0001 lr-1p5e4: dropped LR to 1.5e-4, no change vs v3 baseline
11d2b5d	0.7360	0:138,1:250,2:102,3:10	0.270	2301	keep	0002 drop-reasoning-arg: reverted to v1 message-only tool args, +2.8pp vs v3
a4aa049	0.7180	0:287,1:175,2:35,3:3	0.278	2301	discard	0003 lr-1p5e4 on message-only: LR drop hurts in this format too
549e967	0.7020	0:432,1:45,2:19,3:4	0.231	3301	discard	0004 mix-1k-pure-math: cadence collapsed (86% 0-calls); pure-math fraction too high
8952548	0.7280	0:169,1:222,2:100,3:8,4:1	0.271	2301	discard	0005 lora-rank-8: smaller rank slightly worse than 0002 rank-32
4b71509	0.7280	0:138,1:258,2:97,3:7	0.260	2216	discard	0006 filter-short-thinking: min 4000 chars dropped only 3.5%; no effect
ca90f2c	0.7100	0:481,1:17,2:2	0.288	700	discard	0007 subsample-800: cadence collapsed (96% 0-calls); too few records
fd7bc1e	0.7040	0:178,1:209,2:93,3:20	0.203	2301	discard	0008 epochs-2: overfits (NLL 0.20) but accuracy drops
d966768	0.7160	0:479,1:20,2:1	0.199	2301	discard	0009 sparser-teacher: cadence collapsed (96% 0-calls); too few tool examples
7af609f	0.7020	0:218,1:250,2:32	0.243	2302	discard	0010 mid-cadence-teacher: training 100% tool-using but eval cadence drifts to 44% 0-calls
7c80263	0.7400	0:145,1:237,2:110,3:8	0.239	2302	keep	0011 rename-checkpoint: tool name + self-bookkeeping framing; +0.4pp vs 0002
a25b642	0.7240	0:138,1:213,2:140,3:9	0.239	2302	discard	0012 lora-rank-16: 16 underperforms 32 by 1.6pp
56e8953	0.7320	0:142,1:222,2:128,3:8	0.239	2302	discard	0013 lora-rank-64: rank 64 worse than 32; rank peaks at 32
cf4b06c	0.7100	0:134,1:279,2:79,3:8	0.234	1778	discard	0014 filter-8k: 22% dropped, accuracy regressed 3pp
ff82890	0.7220	0:180,1:218,2:101,3:1	0.239	2302	discard	0015 stronger-self-bookkeeping: too aggressive framing; 0011 mid-level is sweet spot
4c8590e	0.7080	0:155,1:215,2:119,3:11	0.238	2302	discard	0016 system-prompt-directive: explicit cadence directive regressed 3pp
d633ad9	0.7380	0:174,1:219,2:95,3:12	0.252	4687	discard	0017 larger-dataset: 2x records (4787 SFT) didn't move accuracy; 0.74 ceiling is structural
ae2d2cc	0.6580	0:4,2:2,3:149,4:256,5:66,6:10,7:3,8:10	0.225	4687	discard	0018 mask-thinking: cadence exploded to 4-call median; -8.2pp
b109c68	0.7060	0:149,1:254,2:87,3:10	-	2302	discard	0019 early-stop-step-80: 0011 mid-training checkpoint underperforms final (0.706 vs 0.740)
cd53c55	0.7740	0:224,1:203,2:35,3:15,4:6,5:2,6:5,8:10	-	0	keep	0020 prompt-only no-SFT BEATS all SFT (0.774 > 0.740); MAJOR result
613a6af	0.7640	0:287,1:131,2:30,3:14,4:13,5:3,6:3,7:3,8:16	-	0	discard	0021 minimal-description prompt-only: shorter desc hurts (0.764 < 0020 0.774)
6545d41	0.7920	0:395,1:57,2:33,3:3,4:6,5:2,6:1,8:2,10:1	-	0	keep	0022 prompt-only + sparing system prompt: +1.8pp over 0020; new best at 0.7920
ed74cad	0.7880	0:439,1:35,2:17,3:5,4:2,8:2	-	0	discard	0023 optional-tool prompt: more suppression dropped acc to 0.788 (vs 0022 0.792)
a1f1a51	0.7980	0:412,1:58,2:12,3:11,4:3,5:2,8:2	-	0	keep	0024 directive in user message: new best 0.798 (+0.6pp over 0022)
25421da	0.7920	0:447,1:33,2:13,3:5,5:1,6:1	-	0	discard	0025 system+user reinforce: redundancy hurt slightly (0.792 < 0024 0.798)
8f964f4	0.7800	0:416,1:48,2:19,3:9,5:4,6:2,7:1,8:1	-	0	discard	0026 concrete-example in description: -1.8pp (verbose hurt)
ecd0d34	0.7780	0:234,1:181,2:48,3:16,4:7,5:6,6:2,7:1,8:5	-	0	discard	0027 shorter-directive: less suppression, -2pp (0.778 < 0024 0.798)
9ae6978	0.4820	0:500	0.368	100	discard	0028 tiny-sft-100: catastrophic; 100% 0-call AND accuracy 0.482 (under-trained adapter)
95fb174	0.7800	0:361,1:95,2:25,3:7,4:7,5:1,6:2,7:1,8:1	-	0	discard	0029 note-to-self name: -1.8pp (renaming increased tool use)
9b96f6f	0.7900	0:410,1:57,2:20,3:5,4:4,5:2,7:1,8:1	-	0	discard	0030 shorter-message-param: -0.8pp (noise)
d012c85	0.7640	0:377,1:72,2:28,3:5,4:7,5:5,7:1,8:5	-	0	discard	0031 drop-dont-think-too-long: -3.4pp (guard load-bearing)
d0f26c2	0.7820	0:397,1:57,2:26,3:10,4:3,5:4,6:1,8:2	-	0	discard	0032 reorder-directive-first: -1.6pp (order matters)
4dd432a	0.7720	0:500	-	0	anchor	0033 agent-loop NO tool: 0.772; true gap vs 0024 is only +2.6pp added by tool
efbd465	0.7980	0:404,1:80,2:10,3:2,4:2,5:1,8:1	-	0	discard	0034 tool-ack-continue: no effect vs 0024
b886427	0.7440	0:148,1:242,2:102,3:8	-	2302	discard	0035 0011sft + 0024 prompt: SFT + directive hurts (0.744 << base+directive 0.798)
29f19a6	0.8100	0:487,1:12,2:1	-	0	keep	0036 think-step-by-step: NEW BEST 0.810 (+1.2pp); cadence collapsed to 2.6%
1867c8a	0.7840	0:307,1:159,2:21,3:11,5:1,6:1	-	0	discard	0037 cot-no-directive: dropping directive hurt 2.6pp; sparing is load-bearing
7ebe801	0.7640	0:297,1:132,2:30,3:27,4:9,5:5	-	0	discard	0038 cot-soft-tool: -4.6pp; soft framing recovers cadence but loses accuracy
8319121	0.7520	0:500	-	0	anchor	0039 CoT + NO tool: 0.752; tool presence adds +5.8pp on top of CoT
13bb63f	0.7720	0:466,1:31,2:3	-	0	discard	0040 reason-carefully: phrasing matters; -3.8pp
30c6895	0.7940	0:483,1:17	-	0	variance	0041 0036-rerun: 0.794 (vs 0036's 0.810); within noise (eval std ~1.7pp)
2b6678e	0.7940	0:486,1:12,2:1,4:1	-	0	discard	0042 expert-system-prompt: noise; system prompt does nothing on top of 0036
2655cef	0.7920	0:483,1:14,2:3	-	0	discard	0043 lets-think-step-by-step: noise (~0.80 plateau)
39edc7e	0.7900	0:486,1:12,2:1,4:1	-	0	variance	0044 0036-rerun-3: 0.790; 3-sample mean 0.798 ≈ 0024; cadence is the deciding factor → 0024 wins
c5bc8f0	0.8040	0:413,1:49,2:23,3:4,4:5,5:1,6:2,7:1,8:2	-	0	variance	0045 0024-rerun: 0.804 (2-sample mean 0.801) — 0024 confirmed best with healthy cadence
63558b1	0.7940	0:399,1:65,2:20,3:11,4:3,6:1,7:1	-	0	discard	0046 markdown user msg: noise (0.794 within 0024's CI)
7faef8d	0.8000	0:462,1:22,2:10,3:1,4:3,6:1,8:1	-	0	discard	0047 explicit-cadence-target: noise (0.80; cadence slightly recovered to 8%)
992bfa7	0.7780	0:357,1:117,2:17,3:6,4:1,5:1,7:1	-	0	discard	0048 partial-directive: dropped 'for simple problems' sentence; -2pp
f221a91	0.7900	0:407,1:63,2:21,3:4,4:2,5:1,8:2	-	0	variance	0049 0024-rerun-3: 0.790 — 3-sample 0024 mean 0.797±0.007; FINAL: 0024 is converged best
5774a7e	0.7960	0:415,1:48,2:22,3:8,5:4,6:2,8:1	-	0	discard	0050 max-turns-16: no effect (8-cap not binding); reverted
b4313f8	0.8020	0:397,1:69,2:19,3:8,4:3,5:2,8:2	-	0	variance	0051 0024-rerun-4: 0.802; 4-sample mean 0.799±0.006 (CI [0.787, 0.811])
164416f	0.7920	0:379,1:79,2:22,3:6,4:4,5:3,6:4,8:3	-	0	discard	0052 verify-before-final: noise (within 0024 CI)
c6b5cbc	0.7820	0:428,1:3,2:62,3:2,4:2,6:1,8:1,16:1	-	0	discard	0053 quantitative-cadence-2: shape biased to 2 calls but acc within noise
abf5bf0	0.7720	0:407,1:65,2:12,3:7,4:3,5:1,6:1,8:4	-	0	discard	0054 numbered-tool-ack: 'Checkpoint N recorded' instead of 'ok'; slight regression
2194241	0.8000	0:402,1:63,2:20,3:8,4:2,6:2,8:3	-	0	variance	0055 0024-rerun-5: 0.800; 5-sample mean 0.799±0.005, CI [0.789, 0.809]
fe4269f	0.7840	0:469,1:13,2:11,3:2,4:1,5:1,7:1,8:2	-	0	discard	0056 one-shot system example: cadence collapsed; slight regression
19c9415	0.7880	0:403,1:59,2:23,3:4,4:3,5:2,6:1,8:5	-	0	variance	0057 0024-rerun-6: 0.788; 6-sample mean 0.797±0.006
1138460	0.5960	0:431,1:46,2:13,3:6,4:2,5:1,8:1	-	0	discard	0058 half-max-tokens: catastrophic truncation; reverted
6aa0a32	0.8460	0:405,1:58,2:18,3:11,4:3,5:1,7:1,8:3	-	0	keep	0059 max_tokens 12288: NEW BEST 0.846 (+4.7pp); eval cap was binding
869fb56	0.8320	0:403,1:60,2:25,3:6,4:1,5:2,6:1,8:2	-	0	keep	0060 0059 rerun: 0.832; 2-sample mean 0.839 (max_tokens=12288 gain confirmed)
6cc6a58	0.8600	0:404,1:61,2:24,3:4,4:3,5:2,6:1,8:1	-	0	keep	0061 2x-max-tokens: 0.860 (still climbing with max_tokens=16384)
2ae9161	0.8700	0:378,1:77,2:23,3:13,4:1,6:2,7:2,8:4	-	0	keep	0062 3x-max-tokens: 0.870 (+1pp); approaches no-tool baseline 0.880
3f84cf4	0.8660	0:395,1:68,2:23,3:6,4:3,5:3,8:2	-	0	keep	0063 max_tokens 28672: 0.866 (saturated near 0.87; curve flat above 24576)
eba40f1	0.8760	0:477,1:20,2:1,3:2	-	0	discard	0064 cot-prefix + max_tokens=24576: 0.876 BUT cadence degenerate (95.4% 0-call); reverted CoT prefix
1f5126f	0.8620	0:315,1:131,2:32,3:18,4:1,7:1,8:2	-	0	discard	0065 cot-no-suppressor: 0.862 (cadence healthy 63% 0-call but accuracy -0.8pp vs 0062); reverted
bd5edb4	0.8500	0:392,1:61,2:28,3:8,4:3,5:1,6:1,7:2,8:4	-	0	discard	0066 shorter-tool-spec: 0.850 (-2pp vs 0062; verbose spec acts as latent reasoning scaffold)
2e4b25e	0.8560	0:360,1:84,2:28,3:14,4:3,5:2,6:2,7:2,8:5	-	0	discard	0067 verbose-tool-spec: 0.856 (rubric overload; non-monotonic — 0062 wording is at peak)
6cf9d91	0.8560	0:352,1:72,2:45,3:7,4:8,5:6,6:2,7:4,8:4	-	0	discard	0068 drop-dont-think-too-long: 0.856 (anti-rumination guidance was load-bearing); reverted
b54eb86	0.8600	0:382,1:75,2:19,3:12,4:2,5:3,6:1,7:1,8:5	-	0	discard	0069 add-verify-sentence: 0.860 (-1pp; additive verify directive didn't help); reverted
876e025	0.8640	0:395,1:65,2:26,3:6,4:4,5:1,6:2,8:1	-	0	variance	0070 0062 variance rerun: 0.864 (2-sample mean 0.867 ± 0.3pp; corroborates 0062 baseline)
02f1830	0.8540	0:396,1:56,2:20,3:9,4:6,5:3,6:3,7:1,8:6	-	0	discard	0071 directive-reorder: 0.854 (boxed-last hurt; -1.3pp vs 0062 mean, genuine regression); reverted
e40bd07	0.8660	0:439,1:38,2:12,3:4,4:2,5:1,6:2,7:1,8:1	-	0	discard	0072 system-prompt-rubric: 0.866 (parity acc; cadence weaker 87.8% 0-call); reverted
350bb65	0.8580	0:373,1:87,2:26,3:5,4:3,5:2,8:4	-	0	discard	0073 rename-scratchpad: 0.858 (-0.9pp; 'checkpoint' is optimal name); reverted
3c974b5	0.8620	0:401,1:72,2:21,3:4,8:2	-	0	discard	0074 echo-tool-ack: 0.862 (within noise; echo no-op); reverted
134df8d	0.8540	0:405,1:50,2:23,3:12,4:2,5:2,6:2,7:1,8:3	-	0	variance	0075 0062 variance rerun #3: 0.854 (3-sample mean 0.863 ± 0.8pp; wider variance than initially estimated)
77da27f	0.8760	0:301,1:91,2:64,3:31,4:12,18:1	-	0	keep	0076 cot-with-soft-cadence: NEW BEST 0.876 +1.6σ accuracy AND healthy cadence (60% 0-call)
8b627ca	0.8540	0:307,1:74,2:69,3:34,4:11,5:3,6:1,12:1	-	0	variance	0077 0076 variance rerun: 0.854 (2-sample mean 0.865 = parity w/ 0062 mean; cadence 40% tool use confirmed healthier)
5a5d5fc	0.8600	0:292,1:36,2:120,3:36,4:11,5:3,7:2	-	0	discard	0078 0076 minus anti-rumination: 0.860 (within noise; conservative revert)
08281b0	0.8520	0:301,1:82,2:76,3:27,4:7,5:3,6:2,8:1,11:1	-	0	variance	0079 0076 variance #3: 0.852 (3-sample mean 0.861 ± 1.4pp; tied w/ 0062 mean 0.863, wins on cadence)
17956b1	0.8760	0:257,1:25,2:15,3:129,4:55,5:6,6:5,7:1,8:4,9:2,14:1	-	0	keep	0080 cadence-up-2-3: 0.876 cadence peak at 3 calls (51% 0-call); successful cadence shape shift
91353db	0.8680	0:264,1:22,2:13,3:132,4:51,5:6,6:7,7:1,8:2,20:1,24:1	-	0	keep	0081 0080 variance rerun: 0.868 (2-sample mean 0.872; both > 0062 max sample; real ~+1pp signal)
7d87c0a	0.8840	0:256,1:28,2:15,3:132,4:42,5:11,6:9,7:1,8:1,9:1,10:2,11:1,12:1	-	0	keep	0082 0080 variance #3: 0.884 (3-sample mean 0.876; BEATS no-tool baseline 0.880; ~49% tool use)
932fb01	0.8700	0:258,1:18,2:7,3:125,4:63,5:17,6:7,7:4,8:1	-	0	discard	0083 cadence-up-3-4: 0.870 (peak unchanged at 3 calls; numerical anchor saturated at 2-3); reverted
de1e1c0	0.8680	0:294,1:10,2:22,3:121,4:34,5:7,6:5,7:1,8:1,9:4,10:1	-	0	discard	0084 0080-plus-verify: 0.868 (null; verify doesn't compound w/ 0080); reverted
b7864d8	0.8600	0:82,1:8,2:33,3:265,4:60,5:9,6:20,7:4,8:2,9:6,10:3,12:1,14:1,15:3,18:1,24:1,28:1	-	0	discard	0085 imperative-cadence: 0.860 (over-saturated cadence 16% 0-call; sweet spot lost); reverted
099aba3	0.8700	0:265,1:17,2:16,3:147,4:38,5:7,6:5,7:1,8:2,9:1,24:1	-	0	variance	0086 0080 variance #4: 0.870 (4-sample mean 0.8745 ± 0.7pp; within 0.55pp of no-tool baseline 0.880)
0b2d7d9	0.8940	0:189,1:17,2:13,3:204,4:46,5:9,6:12,7:2,8:2,9:3,10:1,16:1,21:1	-	0	keep	0087 cleaner-wording: 0.894 single-sample (+1.4pp vs no-tool baseline; +2σ vs 0080 mean; needs corroboration)
24f2042	0.8620	0:192,1:17,2:11,3:214,4:43,5:13,6:5,7:1,8:2,10:1,24:1	-	0	variance	0088 0087 variance rerun: 0.862 (2-sample mean 0.878 ~= 0080's 0.8745; 0.894 was variance pull)
de0e859	0.8600	0:198,1:14,2:17,3:189,4:55,5:13,6:10,7:3,9:1	-	0	variance	0089 0087 variance #3: 0.860 (3-sample mean 0.872; tied w/ 0080 mean 0.8745, wider variance)
28c2e09	0.8560	0:269,1:34,2:18,3:123,4:38,5:6,6:5,7:5,9:1,10:1	-	0	discard	0090 action-oriented-param: 0.856 (-1.85pp; u-sub example was load-bearing template); reverted
e4e9fff	0.8740	0:213,1:23,2:24,3:159,4:50,5:14,6:7,7:3,9:3,12:2,24:2	-	0	discard	0091 add-second-example: 0.874 (within noise; second example decorative); reverted
97d75fa	0.8780	0:305,1:11,2:11,3:109,4:42,5:13,6:3,7:1,8:1,12:1,15:1,21:1,24:1	-	0	keep	0092 minimal-system-identity: 0.878 (identity-only system prompt; within noise; clean addition)
3c4ec99	0.8760	0:299,1:13,2:20,3:119,4:33,5:10,6:4,8:2	-	0	keep	0093 0092 variance rerun: 0.876 (2-sample mean 0.877; very tight variance 0.1pp std)
cc2662f	0.8620	0:304,1:14,2:11,3:120,4:41,5:7,6:2,7:1	-	0	variance	0094 0092 variance #3: 0.862 (3-sample mean 0.872; ceiling confirmed ~0.872-0.875)
e767b7c	0.8800	0:286,1:9,2:9,3:151,4:36,5:4,6:3,7:1,8:1	-	0	keep	0095 system-prompt-tool-meta: 0.880 (at no-tool baseline; needs corroboration)
ed1a810	0.8740	0:289,1:10,2:13,3:142,4:34,5:5,6:3,8:2,12:1,24:1	-	0	variance	0096 0095 variance rerun: 0.874 (2-sample mean 0.877; tool-meta system neutral)
2d149b1	0.8800	0:431,1:36,2:11,3:10,4:5,5:2,6:2,7:2,8:1	-	0	discard	0097 directives-in-system: 0.880 BUT cadence near-degenerate (86% 0-call, 14% tool use); reverted
31c6517	0.8760	0:292,1:8,2:8,3:155,4:26,5:4,6:4,7:1,8:2	-	0	variance	0098 0095 variance #3: 0.876 (3-sample mean 0.877 ± 0.3pp; FINAL recipe; near no-tool baseline 0.880)
b0cf5c5	0.8820	0:296,1:9,2:6,3:137,4:34,5:10,6:5,9:2,10:1	-	0	keep	0099 0095 variance #4: 0.882 (4-sample mean 0.878 ± 0.3pp; AT/above no-tool baseline 0.880)
031303a	0.8820	0:292,1:16,2:11,3:122,4:38,5:10,6:7,7:1,8:1,9:1,16:1	-	0	keep	0100 shorter-system-prompt: 0.882 (parity w/ 0095; cleaner wording wins)
13c079c	0.8700	0:289,1:15,2:12,3:136,4:36,5:8,6:2,9:2	-	0	variance	0101 0100 variance rerun: 0.870 (2-sample mean 0.876; recipe ceiling confirmed)
e0a2443	0.8820	0:302,1:11,2:9,3:137,4:32,5:8,6:1	-	0	variance	0102 0100 variance #3: 0.882 (3-sample mean 0.878; combined 7-sample mean 0.878 ± 0.5pp; RECIPE LOCKED)
c702bb5	0.8740	0:290,1:6,2:7,3:144,4:40,5:8,6:2,8:1,9:1,15:1	-	0	variance	0103 0100 variance #4: 0.874 (8-sample combined mean 0.8775 ± 0.5pp; recipe locked)
f4b9fd4	0.8700	0:227,1:6,2:41,3:167,4:47,5:6,6:4,8:1,12:1	-	0	discard	0104 shorter-user-suffix: 0.870 (cadence shifted up; hedge was moderating; reverted)
08ab4e7	0.8900	0:281,1:2,2:1,3:187,4:20,5:4,6:4,8:1	-	0	keep	0105 single-cadence-three: 0.890 (+1pp vs no-tool baseline; bimodal cadence; needs corroboration)
a913617	0.8780	0:263,1:5,2:4,3:189,4:24,5:5,6:7,12:3	-	0	variance	0106 0105 variance rerun: 0.878 (2-sample mean 0.884; possible +0.7pp gain; bimodal cadence holds)
4b2dd96	0.8660	0:263,1:4,3:207,4:15,5:5,6:4,24:2	-	0	variance	0107 0105 variance #3: 0.866 (3-sample mean 0.878 == 0100 mean; sharper bimodal cadence)
63e1ee1	0.8880	0:238,1:5,2:2,3:231,4:14,5:3,6:5,7:1,8:1	-	0	keep	0108 0105-no-system: 0.888 single-sample (sharper bimodal cadence; no sysprompt; needs corroboration)
e96ce7d	0.8600	0:253,1:7,2:7,3:195,4:18,5:2,6:11,8:1,9:4,12:1,18:1	-	0	variance	0109 0108 variance rerun: 0.860 (2-sample mean 0.874; recipe saturated at ~0.876)
68f2e0a	0.8580	0:254,1:7,2:3,3:217,4:14,6:4,24:1	-	0	discard	0110 0108 variance #3: 0.858 (3-sample mean 0.869; no-sys variant mildly worse); reverted to 0105 recipe
daac6dc	0.8800	0:252,1:3,3:220,4:13,5:2,6:4,7:1,8:1,9:2,12:2	-	0	variance	0111 0105 variance #4: 0.880 (4-sample mean 0.8785; at no-tool baseline)
dea604a	0.8680	0:185,1:3,2:1,3:251,4:18,6:28,8:1,9:4,12:4,15:2,21:1,24:2	-	0	discard	0112 exactly-three: 0.868 (over-saturated cadence); reverted
7b39174	0.8760	0:277,1:3,2:1,3:186,4:24,5:2,6:5,7:1,9:1	-	0	variance	0113 checkpoints-vs-calls: 0.876 (neutral lexical change; matches tool name)
5677a90	0.8700	0:254,1:5,2:2,3:204,4:14,5:3,6:11,7:2,9:2,10:1,12:1,18:1	-	0	variance	0114 different-param-example: 0.870 (example content fungible); reverted
2da9a7e	0.8740	0:249,1:1,3:226,4:13,5:1,6:8,7:1,12:1	-	0	variance	0115 rename-milestone: 0.874 (parity w/ checkpoint); reverted to canonical name
74a4e65	0.8580	0:248,1:6,2:1,3:211,4:18,5:1,6:8,7:2,9:3,12:1,18:1	-	0	variance	0116 0105 variance #5: 0.858 (5-sample mean 0.8744; recipe saturated)
879db06	0.8760	0:359,1:4,3:126,4:6,5:1,6:3,9:1	-	0	discard	0117 directives-prepended: 0.876 (cadence weakened to 28% tool use); reverted
766968c	0.8780	0:272,1:3,2:1,3:189,4:12,5:5,6:9,7:4,8:1,9:2,12:1,15:1	-	0	variance	0118 tool-ack-continue: 0.878 (parity; ack content fungible); reverted to 'ok'
69c3d5f	0.8640	0:251,1:4,2:1,3:211,4:14,5:7,6:7,7:1,8:1,9:2,10:1	-	0	variance	0119 0105 variance #6: 0.864 (6-sample mean 0.8727; converged)
b6c1f13	0.8780	0:305,1:26,2:30,3:82,4:39,5:11,6:6,8:1	-	0	variance	0120 a-few-checkpoints: 0.878 (=0105 mean; smoother cadence; kept for naturalness)
50dee4c	0.8700	0:317,1:21,2:26,3:94,4:33,5:4,6:1,7:2,8:1,9:1	-	0	variance	0121 0120 variance rerun: 0.870 (2-sample mean 0.874; 'a few' equivalent to 'three')
8e187ec	0.8680	0:178,1:7,2:6,3:240,4:35,5:11,6:12,7:1,9:3,12:3,15:2,16:1,24:1	-	0	variance	0122 rename-subgoal: 0.868 (cadence shifted higher; parity acc); reverted to checkpoint
2740627	0.8720	0:258,1:1,2:2,3:216,4:12,5:1,6:7,7:1,9:1,24:1	-	0	variance	0123 0105 variance #7: 0.872 (7-sample mean 0.8726 ± 1.0pp; locked)
91b40bb	0.8780	0:205,1:23,2:13,3:212,4:25,5:5,6:8,7:3,8:2,10:2,11:1,32:1	-	0	variance	0124 reason-carefully: 0.878 (parity; canonical phrasing reverted)
c773300	0.8880	0:261,1:5,2:1,3:201,4:17,5:3,6:6,8:2,9:2,10:1,12:1	-	0	variance	0125 0105 variance #8: 0.888 (8-sample mean 0.8745 ± 1.1pp; locked)
d6e1b92	0.8820	0:174,1:10,2:4,3:257,4:31,5:9,6:9,7:1,8:2,9:2,12:1	-	0	keep	0126 add-confidence-param: 0.882 (at no-tool baseline; cadence shifted up; needs corroboration)
0b7e6f9	0.8740	0:167,1:23,2:2,3:260,4:23,5:10,6:9,7:2,8:2,9:1,20:1	-	0	variance	0127 0126 variance rerun: 0.874 (2-sample mean 0.878; confidence param doesn't compound); reverted
c1de5f5	0.8280	0:46,1:1,2:1,3:308,4:43,5:2,6:38,7:5,8:3,9:19,10:1,11:1,12:6,15:5,18:3,21:2,24:16	-	0	discard	0128 terse-minimal-directive: 0.828 (-4.5pp; cadence over-saturated; verbose hedging is load-bearing); reverted
61ab8a6	0.8780	0:273,1:2,2:1,3:208,4:9,5:1,6:3,8:1,9:1,12:1	-	0	variance	0129 0105 variance #9: 0.878 (9-sample mean 0.8748 ± 1.0pp; rock-solid)
7a230a4	0.8580	0:251,1:2,3:213,4:12,5:3,6:14,7:1,8:1,9:1,24:2	-	0	variance	0130 0105 variance #10: 0.858 (10-sample mean 0.8732 ± 1.1pp; FINAL recipe)
1ca9f85	0.8760	0:247,1:1,3:220,4:16,5:3,6:8,7:2,9:1,10:1,15:1	-	0	variance	0131 organizing-reasoning: 0.876 (parity); reverted
b830aee	0.8900	0:270,1:2,2:2,3:188,4:15,5:3,6:12,7:1,8:1,9:3,12:1,16:1,24:1	-	0	keep	0132 tool-ack-turn-count: 0.890 single-sample (+1.7pp; turn-count meta in ack; needs corroboration)
d267a59	0.8900	0:271,1:5,2:2,3:180,4:21,5:4,6:9,7:1,8:1,9:4,12:1,15:1	-	0	keep	0133 0132 variance rerun: 0.890 (2-sample mean 0.890; +1.7pp; turn-count meta is REAL)
b742426	0.8540	0:266,1:3,2:2,3:189,4:18,5:1,6:17,7:1,8:1,9:1,10:1	-	0	discard	0134 0132 variance #3: 0.854 (3-sample mean 0.878 = parity; turn-count meta NOT real); reverted ack to 'ok'
6f8b50e	0.8680	0:129,1:13,2:7,3:216,4:85,5:15,6:19,7:6,8:4,9:2,10:1,11:1,12:1,20:1	-	0	variance	0135 rename-step: 0.868 (74% tool use; parity acc); reverted to canonical 'checkpoint'
3d99415	0.8240	0:103,1:11,2:18,3:192,4:78,5:29,6:23,7:9,8:10,9:2,10:6,11:1,12:3,14:1,15:4,16:1,18:1,21:2,22:1,24:4,40:1	-	0	crash	0136 0105-variance-rerun-11: 0.824 (BUG: replace_all corrupted directive 'Think checkpoint by checkpoint'); fixed
c11b371	0.8840	0:273,2:2,3:197,4:10,5:6,6:8,7:2,9:2	-	0	variance	0137 0105 post-bugfix rerun: 0.884 (11-sample mean 0.8745; recipe restored)
6833da0	0.8680	0:274,1:1,2:2,3:193,4:20,5:3,6:6,9:1	-	0	variance	0138 0105 variance #12: 0.868 (12-sample mean 0.8737)
2c1a57d	0.8620	0:88,1:1,2:5,3:267,4:90,5:21,6:14,7:2,8:1,9:5,10:1,11:2,20:1,24:2	-	0	variance	0139 rename-thought: 0.862 (82% tool use; parity acc); reverted to checkpoint
0b46f8f	0.8740	0:269,1:1,2:1,3:202,4:14,5:5,6:7,8:1	-	0	variance	0140 0105 variance #13: 0.874 (13-sample mean 0.8740)
d64892b	0.8680	0:302,1:129,2:27,3:33,4:8,5:1	-	0	variance	0141 no-cadence-anchor: 0.868 (cadence peak at 1 instead of 3; parity acc); reverted
d7493e6	0.8800	0:276,2:1,3:196,4:14,5:4,6:8,9:1	-	0	keep	0142 drop-anti-rumination-from-0105: 0.880 (at no-tool baseline; shorter prompt; needs corroboration)
553bfe6	0.8660	0:283,1:1,2:2,3:199,4:8,5:1,6:5,9:1	-	0	variance	0143 0142 variance rerun: 0.866 (2-sample mean 0.873; anti-rumination confirmed non-load-bearing under 0105)
4a60d36	0.8640	0:280,1:1,2:1,3:192,4:14,5:3,6:5,7:1,9:2,12:1	-	0	variance	0144 0142 variance #3: 0.864 (3-sample mean 0.870; simpler recipe at parity)
2c8ad6f	0.8940	0:270,1:4,2:2,3:194,4:16,5:5,6:5,7:1,9:2,18:1	-	0	variance	0145 0105 restore-canonical: 0.894 (14-sample mean 0.8757; canonical w/ anti-rumination restored)
23c384d	0.8720	0:270,1:6,2:2,3:193,4:16,5:1,6:7,7:1,9:2,12:1,24:1	-	0	variance	0146 0105 variance #15: 0.872 (15-sample mean 0.8755)
85036f1	0.8700	0:497,3:2,4:1	-	20	discard	0147 tiny-sft-20: 0.870 BUT cadence catastrophic (99.4% 0-call); SFT signal dominates even at 20 records
43be219	0.8840	0:254,1:5,3:216,4:15,5:3,6:4,9:1,12:1,18:1	-	0	variance	0148 0105 variance #16: 0.884 (16-sample mean 0.8761)
6f48134	0.8620	0:262,1:3,2:2,3:204,4:14,5:4,6:9,8:1,9:1	-	0	variance	0149 0105 variance #17: 0.862 (17-sample mean 0.8753)
