commit	accuracy	cadence	test_nll	training_records	status	description
57c95dd	0.8660	0:268,1:4,2:2,3:201,4:16,6:6,9:1,10:1,18:1	-	0	variance	0150 0105 variance #18: 0.866 (18-sample mean 0.8748; 150-exp milestone)
4f8728e	0.8820	0:265,1:3,2:1,3:198,4:15,5:2,6:13,7:1,9:1,12:1	-	0	variance	0151 0105 variance #19: 0.882 (19-sample mean 0.8752)
8c97726	0.8820	0:262,1:3,2:2,3:206,4:16,5:2,6:7,7:1,23:1	-	0	variance	0152 0105 variance #20: 0.882 (20-sample mean 0.8755 ± 1.0pp; 95% CI [0.871, 0.880]; baseline-equiv)
5a7598c	0.8720	0:258,1:2,2:2,3:210,4:11,5:3,6:9,7:1,8:1,9:1,12:1,24:1	-	0	variance	0153 0105 variance #21: 0.872 (21-sample mean 0.8753)
f9cb9e2	0.8740	0:276,1:2,3:192,4:13,5:4,6:9,7:1,9:3	-	0	variance	0154 0105 variance #22: 0.874 (22-sample mean 0.8752)
7d16205	0.8780	0:260,1:1,2:3,3:204,4:16,5:5,6:9,9:1,18:1	-	0	variance	0155 0105 variance #23: 0.878 (23-sample mean 0.8753)
d100ed9	0.8720	0:251,1:6,3:216,4:10,5:5,6:10,7:1,12:1	-	0	variance	0156 0105 variance #24: 0.872 (24-sample mean 0.8751)
388b936	0.8740	0:251,1:4,2:1,3:212,4:17,5:1,6:5,7:3,12:3,15:1,17:1,21:1	-	0	variance	0157 0105 variance #25: 0.874 (25-sample mean 0.8751)
6c03948	0.8720	0:254,1:1,2:2,3:220,4:12,5:3,6:1,7:1,9:4,10:1,17:1	-	0	variance	0158 0105 variance #26: 0.872 (26-sample mean 0.8750)
73b6ce8	0.8740	0.022	0.4466	0:259,1:5,3:212,4:11,5:2,6:5,7:1,9:2,12:1,15:1,18:1	0	-	keep	0161 v2 rebaseline (0105 prompt-only): in_think=0.000, turn_split=0.022 — primary_score baseline for v2
pending	0.7940	0.274	0.5058	0:42,1:3,2:2,3:272,4:45,5:14,6:42,7:11,8:3,9:13,10:1,11:3,12:6,14:2,15:4,18:1,20:4,22:1,24:25,25:1,27:1,30:1,32:2,40:1	0	-	keep	0162 explicit-between-steps: in_think=0.018, turn_split=0.268 — placement directive lifts interleaving 12x at -8pp accuracy cost
pending	0.7360	0.398	0.5145	0:20,3:210,4:63,5:15,6:44,7:7,8:6,9:9,10:9,11:2,12:17,13:2,14:1,15:5,16:2,18:7,19:3,21:4,22:4,23:1,24:47,25:2,26:3,27:2,28:3,29:4,32:5,33:1,35:1,40:1	0	-	keep	0163 cap-at-four: in_think=0.004, turn_split=0.396 — cap language failed, runaway tail (47 rollouts at 24 calls)
pending	0.2360	0.932	0.2280	0:10,2:1,3:39,4:7,5:2,6:21,7:1,8:11,9:19,10:4,11:4,12:12,13:6,14:3,15:18,16:2,17:4,18:13,19:5,20:8,21:10,22:7,23:3,24:245,25:3,26:2,27:6,28:13,29:3,30:5,31:4,32:5,33:1,34:1,36:1,64:1	0	-	discard	0164 exactly-three: catastrophic collapse — 245/500 rollouts hit max_turns=8 with 3 tool calls per turn (24 total) never writing answer; reverted USER_INSTRUCTION_SUFFIX to 0163 state
pending	0.8120	0.316	0.5343	0:41,1:2,3:203,4:78,5:23,6:43,7:11,8:11,9:14,10:8,11:4,12:17,13:3,14:1,15:4,16:6,18:2,19:1,20:2,21:4,22:2,24:6,25:1,26:1,27:3,28:2,30:1,32:3,33:1,40:1,43:1	0	-	keep	0165 trimmed-between-steps: in_think=0.004, turn_split=0.316 — trimmed prompt to ~40 words recovered 7.6pp accuracy NEW BEST primary_score
pending	0.8860	0.070	0.4740	0:174,1:6,2:9,3:230,4:39,5:17,6:8,7:4,8:3,9:2,10:2,12:2,13:1,15:1,18:1,21:1	0	-	discard	0166 system-prompt-placement: best accuracy 0.886 but interleaving collapses without per-turn directive; reverted to 0165
pending	-	-	-	-	-	-	crash	0167 tool-ack-continue: context window overflow killed asyncio.gather; reverted ack to "ok" and added per-problem exception handling to prevent recurrence
pending	0.8100	0.404	0.5686	0:43,1:1,2:1,3:180,4:84,5:32,6:41,7:12,8:12,9:25,10:8,11:2,12:6,13:7,14:4,15:8,16:3,17:3,18:4,19:1,21:6,22:1,23:1,24:9,27:1,28:1,30:1,32:1,33:1,40:1	0	-	keep	0168 tool-ack-continue: in_think=0.022 (5x), turn_split=0.400 — ack "noted; continue your reasoning" lifts placement without accuracy cost NEW BEST
pending	0.6300	0.710	0.5386	0:51,1:1,2:1,3:56,4:70,5:40,6:44,7:20,8:17,9:20,10:33,11:19,12:18,13:4,14:2,15:5,16:6,17:4,18:9,19:2,20:4,21:5,22:3,23:2,24:25,25:6,26:4,27:1,28:3,29:1,30:2,31:1,32:14,33:1,34:1,35:1,36:1,38:1,40:1,45:1	0	-	discard	0169 milestone-ack: directive ack pushed cadence too high, accuracy -18pp; reverted to 0168 ack
pending	0.8820	0.310	0.5777	0:31,1:1,2:1,3:186,4:149,5:31,6:88,7:6,8:3,9:4	0	-	keep	0170 state-aware-ack: throttle ack after 4 calls — tail eliminated, accuracy 0.882 (near no-tool baseline) NEW BEST
pending	0.8740	0.048	0.4580	0:34,1:3,3:298,4:123,5:25,6:7,7:2,8:1,9:3,10:2,12:1,15:1	0	-	discard	0171 throttle-at-3: threshold = natural mode collapses turn_split to 0.046; reverted to threshold=4
pending	0.8620	0.280	0.3444	0:46,1:2,2:3,3:188,4:146,5:21,6:80,7:9,8:1,9:3,15:1	0	-	keep	0172 v2.1 rebaseline (0170 recipe): split_balance=0.029 reveals batched-after-think pathology efficiency=0.793 primary_score drops 0.5777->0.3444
pending	-	-	-	-	-	-	keep	0173 phaseA-scaffold: opsd_train.py scaffold with privileged-info teacher prompt helper; cookbook on_policy_distillation cannot do split prompts without recipe-level override (TODO list in module docstring)
pending	-	-	-	-	-	-	keep	0174 phaseA-rollout-fn: roll_out_student smoke-tested on 3 problems (idx 501 produced 5-turn/4-call cross-turn cadence). Next: teacher logprob scoring (TODO 2)
pending	-	-	-	-	-	-	keep	0175 phaseA-teacher-score: score_with_teacher works after switching to Qwen3Renderer(strip_thinking_from_history=False); teacher mean logprob -0.288 on student tokens. Next: forward_backward step (TODO 3)
pending	-	-	-	-	-	-	keep	0177 phaseA-datum-assembly: assemble_opsd_datum works; adv mean -0.175 std 1.18 range [-29 +8] on idx 500; teacher modes A/B/C parameterized. Next: forward_backward (TODO 4)
pending	-	-	-	-	-	-	keep	0178 phaseA-fwdbwd: END-TO-END OPSD training step working (rollout->teacher score->datum->forward_backward->optim_step). Loss output mean -0.407. Next: opsd_train.main outer loop (TODO 5)
pending	-	-	-	-	-	-	keep	0180 phaseA-outerloop-smoke: 2-step OPSD verified end-to-end mean_lp moved -0.619 to -0.556. checkpoints step_1/step_2 saved. Next: full Phase A training run (max_steps=20)
a2923ff2/step_2	0.8420	0.976	0.2746	0:7,1:5,2:8,3:132,4:327,5:15,6:3,7:2,8:1	7	2	keep	0181 opsd-step2-eval FIRST PHASE A SIGNAL split_balance 0.029->0.443 (15x) turn_split 0.28->0.976 BUT mean_tokens doubled efficiency 0.793->0.455 net primary -0.07
371fafae/step_4	0.8420	0.974	0.2703	0:6,1:7,2:6,3:143,4:319,5:11,6:4,7:3,8:1	29	4	discard	0182 opsd-concise-teacher: concise wording neutral mean_tokens 12245 split_balance 0.441 same as 0181
8cf85315/step_4	0.8140	0.972	0.2567	0:8,1:6,2:7,3:167,4:287,5:15,6:4,7:3,8:3	27	4	discard	0183 opsd-kl025: lower KL hurt accuracy 2.8pp without improving placement. Teacher distribution is intrinsically long-traced regardless of KL
22e1e84d/step_4	0.8280	0.976	0.2462	0:6,1:6,2:11,3:159,4:295,5:17,7:1,8:5	28	4	discard	0184 opsd-placement-only: removing answer from teacher did not help mean_tokens 13028 (worse). All OPSD variants converge to 0.42 split_balance 12-13k tokens. Move to Phase B (RFT)
d67d246	-	-	-	-	-	-	keep	0185 phaseB-rft-smoke: sample+score+filter pipeline verified — 80 rollouts on 20 problems frac_correct 0.85 frac_interleaved 1.0 17 positives kept score_mean 0.418 score_max 0.866
aad26afe/step_5_final	0.8100	0.968	0.2433	0:10,1:6,2:5,3:149,4:307,5:15,6:3,7:3,8:2	17	5	keep	0186 phaseB-rft-smoke-eval: from-scratch SFT on 17 RFT positives — pipeline works tiny dataset hurts vs OPSD. Scale sampling next.
6dac22cc/step_32_final	0.8340	0.638	0.3722	0:40,1:137,2:216,3:93,4:14	125	32	keep	0187 phaseB-rft-125pos NEW V3 BEST split_balance 0.515 mean_tokens 8187 -- RFT directly optimized v2.1 metric beats v2.1 baseline +0.028
41d4a9ad/step_30_final	0.7700	0.022	0.3876	0:465,1:23,2:8,3:4	120	30	discard	0188 phaseB-rft-expert-iter METRIC GOODHART nominal primary_score up to 0.3876 but model abandoned the tool (turn_split 0.022) — exposed 0.5 floor in primary_score formula
846a776b/step_36_final	0.7940	0.022	0.0088	0:477,1:11,2:11,4:1	141	36	discard	0190 phaseB-rft-v2p2-positives: SFT on 141 interleaved positives still produced tool-abandoning model. Small dataset + from-scratch likely overfits final-answer pattern
6d587936/step_36_final	0.8340	0.910	0.1994	0:9,1:36,2:123,3:273,4:58,5:1	141	36	keep	0191 phaseB-rft-fixed-datum NEW V3 BEST split_balance 0.494 mean_tokens 10349 turn_split 0.910 - ToolCall datum reconstruction fix
93010f63/step_40_final	0.8320	0.128	0.0481	0:240,1:195,2:53,3:12	158	40	discard	0192 phaseB-rft-iter-on-0191: RFT-from-scratch on 0191 positives caused tool-use regression turn_split 0.91 -> 0.13 - 0191 was sweet spot for iteration count
8b129873/step_68_final	0.8540	0.938	0.2025	0:1,1:30,2:108,3:288,4:72,5:1	266	68	keep	0193 phaseB-rft-large-batch NEW V3 BEST 266 positives accuracy +2pp over 0191 (0.854) mode 3 calls
61ccd3f4/step_44_final	0.8420	0.910	0.1908	0:7,1:38,2:142,3:260,4:51,5:1,6:1	171	44	discard	0194 phaseB-rft-strict-threshold dataset size beats purity 171 high-q positives worse than 266 mixed-q at 0193
7f7c3b6a/step_78_final	0.8360	0.896	0.1962	0:2,1:50,2:134,3:252,4:61,5:1	309	78	discard	0195 phaseB-rft-thresh03 600prob 2400 rollouts threshold 0.3 - 309 positives, marginal regression vs 0193
e90afa37/step_2	0.8200	0.980	0.1488	0:8,1:2,2:7,3:136,4:321,5:16,6:4,7:3,8:3	-	6	discard	0196 phaseC-rl-rloo RL 6 steps from 0193 warmstart on-policy 0.327->0.357->0.267->0.210->0.347->0.229 held-out step2 0.1488 - no KL anchor drift
